{
  "schema": "rpm.telemetry.v1",
  "msg_id": "01920c4e-8000-7000-8000-000000000001",
  "device_id": "sim-icu-90000007",
  "seq": 42,
  "source": "icu_gateway",
  "context": "icu",
  "ts": {
    "window_start": "2026-10-02T10:15:00Z",
    "window_end": "2026-10-02T10:15:30Z",
    "edge_sent": "2026-10-02T10:15:30.120Z"
  },
  "metrics": {
    "heart_rate": { "mean": 118, "min": 112, "max": 124, "n": 30, "quality": 0.99 },
    "spo2": { "value": 91, "quality": 0.97 },
    "resp_rate": { "value": 24 },
    "sbp": { "value": 98 },
    "dbp": { "value": 58 },
    "temp": { "value": 38.6 },
    "gcs": { "value": 14 }
  }
}
